{
  "schemaVersion": 1,
  "id": "arxiv-2610.27913",
  "arxivId": "2610.27913",
  "title": "ACE-Compression: An Ability-Centric Evaluation of Compressed Large Language Models",
  "acronym": "ACE-Compression",
  "authors": [
    "Jiahui Ning",
    "Liang Chen",
    "Yuchen Liang",
    "Yi Zhang",
    "Fenglei Fan"
  ],
  "paperUrl": "https://arxiv.org/abs/2610.27913v1",
  "publishedAt": "2026-10-20",
  "versionUpdatedAt": "2026-10-20",
  "version": 1,
  "addedAt": "2026-10-24",
  "updatedAt": "2026-10-24",
  "checkedAt": null,
  "role": "evaluation_framework",
  "targets": [
    "llm"
  ],
  "scenarios": [
    "general",
    "knowledge"
  ],
  "capabilities": [
    "reasoning",
    "knowledge",
    "grounding",
    "robustness"
  ],
  "summaryZh": "论文提出ACE-Compression能力中心评测框架，用于分析量化和剪枝等压缩方法对大语言模型底层能力的影响。框架从程序推理与约束执行、知识 grounding 与真实性、社会认知与情感理解、人格一致性与风格保持四个部署相关维度进行评测。基于六个开源权重模型的35个以上压缩检查点，研究发现压缩会重新分配能力画像，量化整体上比剪枝保留更多能力，但不同方法的实际价值取决于应用所需能力。",
  "taskFormat": "针对压缩后大语言模型的多维能力探测与保留度比较评测。",
  "metrics": [],
  "officialCode": null,
  "officialData": null,
  "sources": [
    {
      "url": "https://arxiv.org/abs/2610.27913v1",
      "kind": "arxiv_abstract",
      "version": "v1",
      "checkedAt": null,
      "scope": "arXiv API 元数据与摘要，自动获取，尚未人工核查。 材料来自 2026-10-24T07:19:57Z 完成的采集快照；本次整理使用已保存材料，不代表重新获取论文。"
    }
  ],
  "review": {
    "status": "needs_review",
    "reviewer": null,
    "reviewedAt": null
  },
  "reproduction": {
    "status": "unverified",
    "notes": null,
    "commands": [],
    "runs": []
  },
  "provenance": {
    "method": "model",
    "generatedAt": "2026-10-24T07:20:53Z",
    "materialScope": "abstract",
    "materialVersion": "v1",
    "materialHash": "c8976d679459efd2b3fc44b21f76c46c99a536d9ef4b36484dc6fc6d3f5f909d",
    "materialTruncated": false,
    "model": "gpt-5.6-luna"
  },
  "publication": "listed",
  "isTest": false
}
