{
  "schemaVersion": 1,
  "id": "arxiv-2610.00666",
  "arxivId": "2610.00666",
  "title": "VisionQ: VLM-as-a-Judge Taxonomy, Dataset and Benchmark for Qualitative Analysis in Computer Vision",
  "acronym": "VisionQ",
  "authors": [
    "Vu Dinh Xuan",
    "Duc-Hai Nguyen",
    "Minh-Dung Dao",
    "Vu Quynh Giao",
    "Quang Hong Nguyen",
    "Binh-Son Hua",
    "Barry O'Sullivan",
    "David Murphy",
    "Hoang D. Nguyen"
  ],
  "paperUrl": "https://arxiv.org/abs/2610.00666v1",
  "publishedAt": "2026-09-30",
  "versionUpdatedAt": "2026-09-30",
  "version": 1,
  "addedAt": "2026-10-04",
  "updatedAt": "2026-10-04",
  "checkedAt": null,
  "role": "introduces_benchmark",
  "targets": [
    "multimodal"
  ],
  "scenarios": [
    "general"
  ],
  "capabilities": [
    "reasoning",
    "grounding",
    "robustness"
  ],
  "summaryZh": "VisionQ 面向计算机视觉论文中的定性比较图，提出标准、数据集与评测基准，要求视觉语言模型依据明确的视觉标准识别作者认为表现最佳的方法输出，而非仅判断总体偏好。该基准包含来自 CVPR 和 ICCV 论文的比较图、人工标注数据、六轴五十一个叶节点的视觉标准分类体系及隐藏方法名等信息的评测协议，并报告不同标准下的判断准确率。对二十种模型的评估显示，最强模型准确率为 63.1%，不同视觉标准间的可靠性差异明显。",
  "taskFormat": "给定比较图及明确视觉标准，在隐藏方法身份和论文信息后，选择符合该标准的最佳输出。",
  "metrics": [],
  "officialCode": null,
  "officialData": null,
  "sources": [
    {
      "url": "https://arxiv.org/abs/2610.00666v1",
      "kind": "arxiv_abstract",
      "version": "v1",
      "checkedAt": null,
      "scope": "arXiv API 元数据与摘要，自动获取，尚未人工核查。 材料来自 2026-10-04T08:28:50Z 完成的采集快照；本次整理使用已保存材料，不代表重新获取论文。"
    }
  ],
  "review": {
    "status": "needs_review",
    "reviewer": null,
    "reviewedAt": null
  },
  "reproduction": {
    "status": "unverified",
    "notes": null,
    "commands": [],
    "runs": []
  },
  "provenance": {
    "method": "model",
    "generatedAt": "2026-10-04T08:30:14Z",
    "materialScope": "abstract",
    "materialVersion": "v1",
    "materialHash": "3ced7ce1654da04c54a93e74d25176cbb88ad86b290f8b59c35147e55dd8d806",
    "materialTruncated": false,
    "model": "gpt-5.6-luna"
  },
  "publication": "listed",
  "isTest": false
}
