{
  "schemaVersion": 1,
  "id": "arxiv-2211.09110",
  "arxivId": "2211.09110",
  "title": "Holistic Evaluation of Language Models",
  "acronym": "HELM",
  "authors": [
    "Percy Liang",
    "Rishi Bommasani",
    "Tony Lee",
    "Dimitris Tsipras",
    "Dilara Soylu",
    "Michihiro Yasunaga",
    "Yian Zhang",
    "Deepak Narayanan",
    "Yuhuai Wu",
    "Ananya Kumar",
    "Benjamin Newman",
    "Binhang Yuan",
    "Bobby Yan",
    "Ce Zhang",
    "Christian Cosgrove",
    "Christopher D. Manning",
    "Christopher Ré",
    "Diana Acosta-Navas",
    "Drew A. Hudson",
    "Eric Zelikman",
    "Esin Durmus",
    "Faisal Ladhak",
    "Frieda Rong",
    "Hongyu Ren",
    "Huaxiu Yao",
    "Jue Wang",
    "Keshav Santhanam",
    "Laurel Orr",
    "Lucia Zheng",
    "Mert Yuksekgonul",
    "Mirac Suzgun",
    "Nathan Kim",
    "Neel Guha",
    "Niladri Chatterji",
    "Omar Khattab",
    "Peter Henderson",
    "Qian Huang",
    "Ryan Chi",
    "Sang Michael Xie",
    "Shibani Santurkar",
    "Surya Ganguli",
    "Tatsunori Hashimoto",
    "Thomas Icard",
    "Tianyi Zhang",
    "Vishrav Chaudhary",
    "William Wang",
    "Xuechen Li",
    "Yifan Mai",
    "Yuhui Zhang",
    "Yuta Koreeda"
  ],
  "paperUrl": "https://arxiv.org/abs/2211.09110v2",
  "publishedAt": "2022-11-16",
  "versionUpdatedAt": "2023-10-01",
  "version": 2,
  "addedAt": "2026-09-10",
  "updatedAt": "2026-09-10",
  "checkedAt": "2026-09-10",
  "role": "evaluation_framework",
  "targets": [
    "llm"
  ],
  "scenarios": [
    "general"
  ],
  "capabilities": [
    "knowledge",
    "robustness"
  ],
  "summaryZh": "提出面向语言模型的综合评测框架，对场景和指标进行分类，并在可行时同时考察准确性、校准、鲁棒性、公平性、偏差、毒性与效率。本文对应最初的 HELM 论文，当前官方工具已继续扩展。",
  "taskFormat": "在统一条件下对多个模型执行跨场景、多指标评测。",
  "metrics": [
    {
      "name": "Accuracy",
      "description": "原论文摘要明确列出的七项评测维度之一；具体计算方法随场景而异。",
      "sourceUrl": "https://arxiv.org/abs/2211.09110v2"
    },
    {
      "name": "Calibration",
      "description": "原论文摘要明确列出的七项评测维度之一；具体计算方法随场景而异。",
      "sourceUrl": "https://arxiv.org/abs/2211.09110v2"
    },
    {
      "name": "Robustness",
      "description": "原论文摘要明确列出的七项评测维度之一；具体计算方法随场景而异。",
      "sourceUrl": "https://arxiv.org/abs/2211.09110v2"
    },
    {
      "name": "Fairness",
      "description": "原论文摘要明确列出的七项评测维度之一；具体计算方法随场景而异。",
      "sourceUrl": "https://arxiv.org/abs/2211.09110v2"
    },
    {
      "name": "Bias",
      "description": "原论文摘要明确列出的七项评测维度之一；具体计算方法随场景而异。",
      "sourceUrl": "https://arxiv.org/abs/2211.09110v2"
    },
    {
      "name": "Toxicity",
      "description": "原论文摘要明确列出的七项评测维度之一；具体计算方法随场景而异。",
      "sourceUrl": "https://arxiv.org/abs/2211.09110v2"
    },
    {
      "name": "Efficiency",
      "description": "原论文摘要明确列出的七项评测维度之一；具体计算方法随场景而异。",
      "sourceUrl": "https://arxiv.org/abs/2211.09110v2"
    }
  ],
  "officialCode": "https://github.com/stanford-crfm/helm",
  "officialData": "https://github.com/stanford-crfm/helm/blob/63754d05db6f874e41a395880fb573890a13e791/README.md",
  "sources": [
    {
      "url": "https://arxiv.org/abs/2211.09110v2",
      "kind": "arxiv_abstract",
      "version": "v2",
      "checkedAt": "2026-09-10",
      "scope": "通过 arXiv Atom API 核对标题、完整作者列表、首发日期、版本更新时间和摘要；未下载或阅读全文。"
    },
    {
      "url": "https://github.com/stanford-crfm/helm/blob/63754d05db6f874e41a395880fb573890a13e791/README.md",
      "kind": "official_repository",
      "version": "63754d05db6f874e41a395880fb573890a13e791",
      "checkedAt": "2026-09-10",
      "scope": "核对官方 README 中的项目归属、任务说明与资源链接；只读取文档，没有执行仓库代码。"
    }
  ],
  "review": {
    "status": "source_verified",
    "reviewer": null,
    "reviewedAt": null
  },
  "reproduction": {
    "status": "official_docs_unrun",
    "notes": "摘录当前文档的安装与十实例示例；当前仓库版本不等于 2022 年原论文实验环境。",
    "commands": [
      {
        "text": "pip install crfm-helm",
        "sourceUrl": "https://github.com/stanford-crfm/helm/blob/63754d05db6f874e41a395880fb573890a13e791/README.md",
        "sourceVersion": "63754d05db6f874e41a395880fb573890a13e791",
        "context": "摘录当前文档的安装与十实例示例；当前仓库版本不等于 2022 年原论文实验环境。"
      },
      {
        "text": "helm-run --run-entries mmlu:subject=philosophy,model=openai/gpt2 --suite my-suite --max-eval-instances 10",
        "sourceUrl": "https://github.com/stanford-crfm/helm/blob/63754d05db6f874e41a395880fb573890a13e791/README.md",
        "sourceVersion": "63754d05db6f874e41a395880fb573890a13e791",
        "context": "摘录当前文档的安装与十实例示例；当前仓库版本不等于 2022 年原论文实验环境。"
      }
    ],
    "runs": []
  },
  "provenance": {
    "method": "source_check",
    "generatedAt": null,
    "materialScope": "abstract_and_official_docs",
    "materialVersion": "v2",
    "materialHash": "79d9822ff756245b64ea6a1ab2ed4eae051edd024a74263e69ce492fbf9306bc",
    "materialTruncated": false,
    "model": null
  },
  "publication": "listed",
  "isTest": false
}
