{
  "schemaVersion": 1,
  "id": "arxiv-2609.34268",
  "arxivId": "2609.34268",
  "title": "SAGE: Symbolic Action-Gating and Editing for LLM Task Planners",
  "acronym": "SAGE",
  "authors": [
    "Trung Minh Bui",
    "JongSul Moon",
    "YoungOuk Kim",
    "Quang-Ngoc Phung",
    "Se-Woong Jun",
    "Dongin Shin"
  ],
  "paperUrl": "https://arxiv.org/abs/2609.34268v1",
  "publishedAt": "2026-09-28",
  "versionUpdatedAt": "2026-09-28",
  "version": 1,
  "addedAt": "2026-09-29",
  "updatedAt": "2026-09-29",
  "checkedAt": null,
  "role": "introduces_benchmark",
  "targets": [
    "llm",
    "agent"
  ],
  "scenarios": [
    "general",
    "tools"
  ],
  "capabilities": [
    "planning",
    "tool-use",
    "grounding",
    "robustness",
    "reasoning"
  ],
  "summaryZh": "本文提出SAGE，一种面向具身家庭智能体任务规划的符号动作门控与编辑方法，并发布75项AI2-THOR基准及无泄漏评测、恢复和安全门控测试框架。SAGE通过符号验证器拦截违反前置条件的动作，仅重生成失败子目标的后缀，并结合混合记忆提升冷启动覆盖。在多目标组合、执行失败恢复和安全监控实验中，方法在较少语言模型调用下保持或提升任务完成率与执行安全性。",
  "taskFormat": "具身家庭智能体的多目标任务规划、执行失败恢复与动作安全验证评测",
  "metrics": [],
  "officialCode": null,
  "officialData": null,
  "sources": [
    {
      "url": "https://arxiv.org/abs/2609.34268v1",
      "kind": "arxiv_abstract",
      "version": "v1",
      "checkedAt": null,
      "scope": "arXiv API 元数据与摘要，自动获取，尚未人工核查。 材料来自 2026-09-29T16:32:12Z 完成的采集快照；本次整理使用已保存材料，不代表重新获取论文。"
    }
  ],
  "review": {
    "status": "needs_review",
    "reviewer": null,
    "reviewedAt": null
  },
  "reproduction": {
    "status": "unverified",
    "notes": null,
    "commands": [],
    "runs": []
  },
  "provenance": {
    "method": "model",
    "generatedAt": "2026-09-29T16:33:57Z",
    "materialScope": "abstract",
    "materialVersion": "v1",
    "materialHash": "52a64ccdec84efc72595dd0194d539c0c79862fbec54c61ea9980b997816c3ff",
    "materialTruncated": false,
    "model": "gpt-5.6-luna"
  },
  "publication": "listed",
  "isTest": false
}
