{
  "schemaVersion": 1,
  "id": "arxiv-2009.03300",
  "arxivId": "2009.03300",
  "title": "Measuring Massive Multitask Language Understanding",
  "acronym": "MMLU",
  "authors": [
    "Dan Hendrycks",
    "Collin Burns",
    "Steven Basart",
    "Andy Zou",
    "Mantas Mazeika",
    "Dawn Song",
    "Jacob Steinhardt"
  ],
  "paperUrl": "https://arxiv.org/abs/2009.03300v3",
  "publishedAt": "2020-09-07",
  "versionUpdatedAt": "2021-01-12",
  "version": 3,
  "addedAt": "2026-09-10",
  "updatedAt": "2026-09-10",
  "checkedAt": "2026-09-10",
  "role": "introduces_benchmark",
  "targets": [
    "llm"
  ],
  "scenarios": [
    "knowledge"
  ],
  "capabilities": [
    "knowledge",
    "reasoning"
  ],
  "summaryZh": "通过 57 个学科任务评估语言模型的知识广度和解题能力，涵盖数学、历史、计算机、法律等领域。论文强调不同学科的表现差异，以及模型在专业知识和自我判断上的不足。",
  "taskFormat": "按学科回答知识与问题求解测试题。",
  "metrics": [
    {
      "name": "Accuracy",
      "description": "各任务回答正确率，并比较跨学科平均表现。",
      "sourceUrl": "https://arxiv.org/abs/2009.03300v3"
    }
  ],
  "officialCode": "https://github.com/hendrycks/test",
  "officialData": "https://people.eecs.berkeley.edu/~hendrycks/data.tar",
  "sources": [
    {
      "url": "https://arxiv.org/abs/2009.03300v3",
      "kind": "arxiv_abstract",
      "version": "v3",
      "checkedAt": "2026-09-10",
      "scope": "通过 arXiv Atom API 核对标题、完整作者列表、首发日期、版本更新时间和摘要；未下载或阅读全文。"
    },
    {
      "url": "https://github.com/hendrycks/test/blob/4450500f923c49f1fb1dd3d99108a0bd9717b660/README.md",
      "kind": "official_repository",
      "version": "4450500f923c49f1fb1dd3d99108a0bd9717b660",
      "checkedAt": "2026-09-10",
      "scope": "核对官方 README 中的项目归属、任务说明与资源链接；只读取文档，没有执行仓库代码。"
    }
  ],
  "review": {
    "status": "source_verified",
    "reviewer": null,
    "reviewedAt": null
  },
  "reproduction": {
    "status": "official_docs_unrun",
    "notes": "官方 README 提供评测代码与数据下载入口；本阶段未核对完整运行命令。",
    "commands": [],
    "runs": []
  },
  "provenance": {
    "method": "source_check",
    "generatedAt": null,
    "materialScope": "abstract_and_official_docs",
    "materialVersion": "v3",
    "materialHash": "c7e3ed209190abd3fc748e6e1e8a9b82bb419cef97f1e78ff428c51720b29161",
    "materialTruncated": false,
    "model": null
  },
  "publication": "listed",
  "isTest": false
}
