{
  "schemaVersion": 1,
  "id": "arxiv-2610.38926",
  "arxivId": "2610.38926",
  "title": "OneScene-Bench: Do Vision-Language Models Integrate Evidence Across Views?",
  "acronym": "OneScene-Bench",
  "authors": [
    "Swathi Suhas",
    "Anurag Das",
    "Bernt Schiele",
    "Jonas Fischer"
  ],
  "paperUrl": "https://arxiv.org/abs/2610.38926v1",
  "publishedAt": "2026-10-28",
  "versionUpdatedAt": "2026-10-28",
  "version": 1,
  "addedAt": "2026-10-30",
  "updatedAt": "2026-10-30",
  "checkedAt": null,
  "role": "introduces_benchmark",
  "targets": [
    "multimodal"
  ],
  "scenarios": [
    "general"
  ],
  "capabilities": [
    "reasoning",
    "grounding",
    "robustness"
  ],
  "summaryZh": "本文提出 OneScene-Bench，一个用于评估视觉语言模型跨视角整合证据能力的受控基准。基准覆盖真实多视图场景中的独特物体计数、跨视图一致性和空间推理，并通过控制物体重叠、局部编辑及跨视角空间关系，区分逐视图处理与场景级证据整合。对十二个视觉语言模型的评测显示，互补视角下计数性能显著下降，跨视图一致性约为50%，表明多图处理与真正整合仍存在明显差距。",
  "taskFormat": "基于真实多视图场景，完成物体计数、跨视图一致性判断和结合多视角证据的空间推理。",
  "metrics": [],
  "officialCode": null,
  "officialData": null,
  "sources": [
    {
      "url": "https://arxiv.org/abs/2610.38926v1",
      "kind": "arxiv_abstract",
      "version": "v1",
      "checkedAt": null,
      "scope": "arXiv API 元数据与摘要，自动获取，尚未人工核查。 材料来自 2026-10-30T16:42:47Z 完成的采集快照；本次整理使用已保存材料，不代表重新获取论文。"
    }
  ],
  "review": {
    "status": "needs_review",
    "reviewer": null,
    "reviewedAt": null
  },
  "reproduction": {
    "status": "unverified",
    "notes": null,
    "commands": [],
    "runs": []
  },
  "provenance": {
    "method": "model",
    "generatedAt": "2026-10-30T16:43:45Z",
    "materialScope": "abstract",
    "materialVersion": "v1",
    "materialHash": "50645864b13e887cca03375997664b5a0af1ed26581effdd74e828eea96092b6",
    "materialTruncated": false,
    "model": "gpt-5.6-luna"
  },
  "publication": "listed",
  "isTest": false
}
